{
  "$schema": "http://json-schema.org/draft-07/schema#",
  "$id": "design-pattern-schema",
  "title": "DesignPattern",
  "description": "Schema for design pattern definitions",
  "type": "object",
  "additionalProperties": false,
  "required": [
    "category",
    "name",
    "intent",
    "problem",
    "context",
    "benefits",
    "tradeoffs",
    "quality_attributes",
    "language_files"
  ],
  "definitions": {
    "patternCategory": {
      "type": "string",
      "enum": [
        "domain-modeling",
        "construction-composition",
        "behavior-selection",
        "interaction-boundary",
        "workflow-messaging",
        "persistence-state",
        "concurrency-resilience",
        "security-verification",
        "specialized-components"
      ],
      "description": "Decision group that owns the pattern (single canonical home; provenance and related_patterns carry cross-listings)"
    },
    "patternScope": {
      "type": "string",
      "enum": [
        "value",
        "object",
        "module",
        "boundary",
        "message-flow",
        "persistence-unit",
        "task-lifetime"
      ],
      "description": "Implementation scope: the kind of program part the decision is local to"
    },
    "language": {
      "type": "string",
      "enum": [
        "generic",
        "c",
        "cplusplus",
        "csharp",
        "go",
        "java",
        "javascript",
        "kotlin",
        "python",
        "ruby",
        "rust",
        "scala",
        "swift",
        "typescript"
      ],
      "description": "Target language of an implementation entry ('generic' for language-neutral guidance)"
    },
    "supportLevel": {
      "type": "string",
      "enum": [
        "native",
        "idiomatic",
        "library",
        "manual",
        "discouraged"
      ],
      "description": "How the language relates to the classic pattern structure: native = absorbed into syntax/stdlib, idiomatic = a simpler local idiom replaces the full form, library = provided by stdlib or dominant framework, manual = full structure must be hand-written, discouraged = language semantics fight it, prefer 'alternative'"
    },
    "paradigm": {
      "type": "string",
      "enum": [
        "oo",
        "functional",
        "concurrent",
        "data-oriented",
        "declarative",
        "procedural"
      ],
      "description": "Programming paradigm the pattern's mechanics belong to"
    },
    "provenance": {
      "type": "string",
      "enum": [
        "gof",
        "eaa",
        "eip",
        "ddd",
        "posa1",
        "posa2",
        "posa3",
        "security-patterns",
        "plop",
        "language-idiom",
        "functional-catalog",
        "smalltalk",
        "xunit-test-patterns",
        "game-programming",
        "modern"
      ],
      "description": "Source catalog the pattern originates from (gof = Gamma et al. 1994, eaa = Fowler PoEAA, eip = Hohpe & Woolf, ddd = Evans/Vernon, posa1-3 = Schmidt et al., security-patterns = Schumacher et al., plop = Pattern Languages of Program Design, language-idiom = e.g. More C++ Idioms, functional-catalog = functional pattern lexicons, smalltalk = Beck 1997, xunit-test-patterns = Meszaros, game-programming = Nystrom, modern = post-2010 web/cloud catalogs)"
    }
  },
  "properties": {
    "category": {
      "$ref": "#/definitions/patternCategory"
    },
    "name": {
      "type": "string",
      "pattern": "^[a-z][a-z0-9]*(-[a-z0-9]+)*$",
      "description": "Pattern name (kebab-case)"
    },
    "aliases": {
      "type": "array",
      "items": {
        "type": "string"
      },
      "default": [],
      "description": "Alternative names (e.g. 'Policy' for Strategy, 'Cheshire Cat' for Pimpl, 'Borg' for shared-state singleton)"
    },
    "intent": {
      "type": "string",
      "description": "One-sentence intent: what the pattern does and what problem it solves (GoF 'Intent' section; the primary queryable summary)"
    },
    "problem": {
      "type": "string",
      "description": "Decision trigger: the concrete recurring problem that warrants this pattern (the catalog's 'Use when' column)"
    },
    "context": {
      "type": "string",
      "description": "Problem context describing when this pattern is applicable"
    },
    "benefits": {
      "type": "array",
      "items": {
        "type": "string"
      },
      "description": "List of benefits this pattern provides"
    },
    "tradeoffs": {
      "type": "array",
      "items": {
        "type": "string"
      },
      "description": "List of tradeoffs and disadvantages"
    },
    "quality_attributes": {
      "type": "object",
      "properties": {
        "testability": {
          "type": "number",
          "minimum": 1,
          "maximum": 10
        },
        "extensibility": {
          "type": "number",
          "minimum": 1,
          "maximum": 10
        },
        "maintainability": {
          "type": "number",
          "minimum": 1,
          "maximum": 10
        },
        "simplicity": {
          "type": "number",
          "minimum": 1,
          "maximum": 10
        },
        "performance": {
          "type": "number",
          "minimum": 1,
          "maximum": 10
        },
        "reliability": {
          "type": "number",
          "minimum": 1,
          "maximum": 10
        },
        "security": {
          "type": "number",
          "minimum": 1,
          "maximum": 10
        },
        "scalability": {
          "type": "number",
          "minimum": 1,
          "maximum": 10
        },
        "observability": {
          "type": "number",
          "minimum": 1,
          "maximum": 10
        },
        "coupling": {
          "type": "number",
          "minimum": 1,
          "maximum": 10
        },
        "discoverability": {
          "type": "number",
          "minimum": 1,
          "maximum": 10
        },
        "type_safety": {
          "type": "number",
          "minimum": 1,
          "maximum": 10
        }
      },
      "required": [
        "testability",
        "extensibility",
        "maintainability",
        "simplicity",
        "performance",
        "reliability",
        "security",
        "scalability"
      ],
      "additionalProperties": false,
      "description": "Numeric 1-10 scores; the eight fixed scoring axes plus the four extended axes in use (observability, coupling, discoverability, type_safety). Axes beyond the eight are not used by the scoring formula; unknown axis names are rejected so typos cannot silently drop a score."
    },
    "quality_attributes_note": {
      "type": "string",
      "description": "Free-text note explaining the assigned quality_attributes scores (why a score is low or high)"
    },
    "performance_notes": {
      "type": "string",
      "description": "Free-text note on measured or expected performance characteristics of this pattern"
    },
    "participants": {
      "type": "array",
      "items": {
        "type": "object",
        "required": [
          "role",
          "responsibility"
        ],
        "properties": {
          "role": {
            "type": "string",
            "description": "Participant name as used in the pattern's collaboration (e.g. Context, Strategy, Subject, Observer)"
          },
          "responsibility": {
            "type": "string",
            "description": "What this participant is responsible for in the collaboration"
          },
          "notes": {
            "type": "string",
            "description": "Free-text clarification for this participant (responsibility boundaries, what it must not do)"
          }
        },
        "additionalProperties": false
      },
      "default": [],
      "description": "Named roles in the pattern structure (GoF 'Participants' section); empty for single-construct idioms"
    },
    "suitable_scopes": {
      "type": "array",
      "items": {
        "$ref": "#/definitions/patternScope"
      },
      "default": [],
      "description": "Program scopes where this pattern works well"
    },
    "unsuitable_scopes": {
      "type": "array",
      "items": {
        "$ref": "#/definitions/patternScope"
      },
      "default": [],
      "description": "Program scopes where this pattern should be avoided"
    },
    "use_cases": {
      "type": "array",
      "items": {
        "type": "string"
      },
      "default": [],
      "description": "Specific use case examples"
    },
    "avoid_when": {
      "type": "array",
      "items": {
        "type": "string"
      },
      "default": [],
      "description": "Situations when this pattern should be avoided (including simpler alternatives that suffice)"
    },
    "pitfalls": {
      "type": "array",
      "items": {
        "type": "string"
      },
      "default": [],
      "description": "Record-level traps when applying the pattern, independent of the chosen language realization (per-language traps live in the language files; the generic realization's own pitfalls in <name>.generic.json)"
    },
    "language_files": {
      "type": "object",
      "description": "V8 language-file map (docs/implementation-guide.md §2.3): declares ALL realization files that join to this record — the generic entry (<name>.generic.json) plus one file per concrete language. Keys are exactly the 14 language enum values (generic + the 13 concrete); values are file names relative to this record's directory (<name>.<language>.json, colocated siblings). Required for every record; the integrity checker rejects any language realization content inside the main record itself.",
      "minProperties": 14,
      "maxProperties": 14,
      "propertyNames": {
        "$ref": "#/definitions/language"
      },
      "required": [
        "generic",
        "c",
        "cplusplus",
        "csharp",
        "go",
        "java",
        "javascript",
        "kotlin",
        "python",
        "ruby",
        "rust",
        "scala",
        "swift",
        "typescript"
      ],
      "additionalProperties": {
        "type": "string",
        "pattern": "^[a-z][a-z0-9]*(-[a-z0-9]+)*\\.[a-z]+\\.json$"
      }
    },
    "paradigm": {
      "type": "array",
      "items": {
        "$ref": "#/definitions/paradigm"
      },
      "default": [],
      "description": "Facet: paradigms this pattern's mechanics belong to (filter, not a second category)"
    },
    "scope": {
      "$ref": "#/definitions/patternScope",
      "description": "Facet: primary implementation scope"
    },
    "provenance": {
      "type": "array",
      "items": {
        "$ref": "#/definitions/provenance"
      },
      "default": [],
      "description": "Facet: source catalogs this pattern is documented in"
    },
    "related_patterns": {
      "type": "array",
      "items": {
        "type": "string"
      },
      "default": [],
      "description": "Conceptually related patterns in the catalog (canonical kebab-case names, resolvable via get_design_pattern)"
    },
    "related_patterns_notes": {
      "type": "object",
      "minProperties": 1,
      "propertyNames": {
        "pattern": "^[a-z][a-z0-9]*(-[a-z0-9]+)*$"
      },
      "additionalProperties": {
        "type": "string"
      },
      "description": "Per-related-pattern distinction notes: key = related pattern name, value = how this pattern differs from or relates to it"
    },
    "anti_patterns": {
      "type": "array",
      "items": {
        "type": "string"
      },
      "default": [],
      "description": "Common anti-patterns and misapplications to avoid"
    },
    "migration_from": {
      "type": "array",
      "items": {
        "type": "string"
      },
      "default": [],
      "description": "Patterns commonly refactored from (e.g. singleton -> dependency injection)"
    },
    "migration_to": {
      "type": "array",
      "items": {
        "type": "string"
      },
      "default": [],
      "description": "Patterns commonly refactored to"
    },
    "design_principles": {
      "type": "array",
      "items": {
        "type": "string"
      },
      "default": [],
      "description": "Core design principles for this pattern (SOLID, composition over inheritance, ...)"
    },
    "best_practices": {
      "type": "array",
      "items": {
        "type": "string"
      },
      "default": [],
      "description": "Recommended best practices"
    },
    "version": {
      "type": [
        "string",
        "null"
      ],
      "default": null,
      "description": "Record version",
      "pattern": "^[0-9]+\\.[0-9]+$"
    },
    "version_history": {
      "type": "array",
      "items": {
        "type": "object",
        "required": [
          "version",
          "changes"
        ],
        "properties": {
          "version": {
            "type": "string",
            "pattern": "^[0-9]+\\.[0-9]+$"
          },
          "date": {
            "type": "string",
            "pattern": "^\\d{4}-\\d{2}-\\d{2}$"
          },
          "changes": {
            "type": "array",
            "items": {
              "type": "string"
            },
            "minItems": 1
          }
        },
        "additionalProperties": false
      },
      "default": [],
      "description": "Record revision history, one entry per released record revision"
    },
    "sources": {
      "type": "array",
      "items": {
        "type": "string"
      },
      "default": [],
      "description": "Source references (books, catalog URLs)"
    }
  }
}
